{
  "$schema": "https://json-schema.org/draft/2020-12/schema",
  "$id": "https://eternal-tuesday-monitor.example/schemas/release.schema.json",
  "title": "Eternal Tuesday Monitor release",
  "type": "object",
  "additionalProperties": false,
  "required": [
    "schema_version",
    "id",
    "monitor_name",
    "data_cutoff",
    "monitor_methodology_version_id",
    "article_source_id",
    "observation_ids"
  ],
  "properties": {
    "schema_version": { "enum": ["1.0.0", "1.1.0"] },
    "id": {
      "type": "string",
      "pattern": "^release-[0-9]{4}-[0-9]{2}-[0-9]{2}$"
    },
    "monitor_name": { "type": "string", "minLength": 1 },
    "data_cutoff": {
      "type": "string",
      "format": "date",
      "pattern": "^[0-9]{4}-[0-9]{2}-[0-9]{2}$"
    },
    "published_on": {
      "type": "string",
      "format": "date",
      "pattern": "^[0-9]{4}-[0-9]{2}-[0-9]{2}$"
    },
    "supersedes_release_id": {
      "type": "string",
      "pattern": "^release-[0-9]{4}-[0-9]{2}-[0-9]{2}$"
    },
    "monitor_methodology_version_id": { "type": "string", "minLength": 1 },
    "freshness_policy_id": { "type": "string", "minLength": 1 },
    "article_source_id": { "type": "string", "minLength": 1 },
    "article_public_path": {
      "type": "string",
      "pattern": "^/",
      "deprecated": true,
      "description": "Historical publication metadata retained for immutable release provenance. It does not assert a current public route."
    },
    "observation_ids": {
      "type": "array",
      "minItems": 1,
      "uniqueItems": true,
      "items": { "type": "string", "pattern": "^[a-z0-9][a-z0-9-]*$" }
    }
  },
  "allOf": [
    {
      "if": {
        "properties": { "schema_version": { "const": "1.1.0" } },
        "required": ["schema_version"]
      },
      "then": {
        "required": [
          "published_on",
          "supersedes_release_id",
          "freshness_policy_id"
        ]
      }
    }
  ]
}
